[
  {
    "iso3": "BFA",
    "zone": "UEMOA",
    "currency": "XOF",
    "name_fr": "Burkina Faso",
    "name_en": "Burkina Faso",
    "independence_year": 1960,
    "independence_footnote_fr": "Indépendance du 5 août 1960 (alors Haute-Volta; renommée Burkina Faso le 4 août 1984). Membre fondateur de l'UMOA — traité du 12 mai 1962.",
    "independence_footnote_en": "Independence 5 August 1960 (then Upper Volta; renamed Burkina Faso on 4 August 1984). Founding member of UMOA — treaty signed 12 May 1962."
  }
]
